{
  "$schema": "https://json-schema.org/draft/2020-12/schema",
  "$id": "https://powerpagesascode.local/schemas/brand-config.schema.json",
  "title": "PowerPagesAsCode brand configuration",
  "type": "object",
  "additionalProperties": false,
  "required": [
    "displayName",
    "siteName",
    "pwaName",
    "shortName",
    "description",
    "packageName",
    "packageScope",
    "frontendPackageName",
    "contractNamespace",
    "databaseName",
    "cicdAppName"
  ],
  "properties": {
    "$schema": { "type": "string" },
    "displayName": { "type": "string", "minLength": 1 },
    "siteName": { "type": "string", "minLength": 1 },
    "pwaName": { "type": "string", "minLength": 1 },
    "shortName": { "type": "string", "minLength": 1, "maxLength": 30 },
    "description": { "type": "string", "minLength": 1 },
    "packageName": { "type": "string", "pattern": "^[a-z0-9][a-z0-9._-]*$" },
    "packageScope": { "type": "string", "pattern": "^@[a-z0-9][a-z0-9._-]*$" },
    "frontendPackageName": {
      "type": "string",
      "pattern": "^@[a-z0-9][a-z0-9._-]*/[a-z0-9][a-z0-9._-]*$"
    },
    "contractNamespace": { "type": "string", "minLength": 1 },
    "databaseName": { "type": "string", "minLength": 1 },
    "cicdAppName": { "type": "string", "minLength": 1 }
  }
}
